{
  "id": "num_knapsack_value",
  "version": "1.0.0",
  "title": "Zero-one knapsack value",
  "category": "numerical_sequence_algorithms",
  "difficulty": "hard",
  "statement": "Items are aligned by index in weights and values. Each item may be chosen at most once. Return the greatest total value whose total weight is at most capacity. Choosing no items is allowed; identical items at different indices are distinct.",
  "constraints": [
    "weights and values have the same length, at most 12",
    "1 <= each weight <= 40; 0 <= each value <= 100",
    "0 <= capacity <= 40",
    "Inputs obey the stated domain; do not mutate caller-owned inputs.",
    "The required return value fits signed 64-bit integers; choose arithmetic that keeps intermediate values within that range. TypeScript uses bigint for integer values.",
    "Do not perform input/output, throw, panic, add tests, or suppress static diagnostics."
  ],
  "adapters": {
    "jett": {
      "signature": "namespace benchmark\n\nfunction knapsack_value(weights: list[int64], values: list[int64], capacity: int64) returns int64",
      "baseline": "baseline.jett",
      "hidden": "hidden.jett",
      "candidate": "solution.jett",
      "grade_mode": "append",
      "commands": [
        [
          "{jett}",
          "build",
          "--check",
          "{candidate}"
        ],
        [
          "{jett}",
          "test",
          "{candidate}"
        ]
      ],
      "forbidden_patterns": [
        {
          "pattern": "(?m)^\\s*(?:other|_)\\s*:",
          "message": "catch-all match arms are forbidden"
        }
      ]
    },
    "python": {
      "signature": "def knapsack_value(weights: list[int], values: list[int], capacity: int) -> int",
      "baseline": "baseline.py",
      "hidden": "hidden.py",
      "support_files": [
        "pyrightconfig.json"
      ],
      "candidate": "solution.py",
      "grade_mode": "separate",
      "commands": [
        [
          "{pyright}",
          "--project",
          "pyrightconfig.json"
        ],
        [
          "python",
          "hidden.py"
        ]
      ],
      "forbidden_patterns": [
        {
          "pattern": "\\bAny\\b|#\\s*(?:type:\\s*ignore|pyright:\\s*ignore)|\\bcast\\s*\\(",
          "message": "Python type bypasses such as Any, casts, and ignored diagnostics are forbidden"
        },
        {
          "pattern": "\\braise\\b",
          "message": "raising exceptions is forbidden"
        }
      ]
    },
    "typescript": {
      "signature": "export function knapsackValue(weights: readonly bigint[], values: readonly bigint[], capacity: bigint): bigint",
      "baseline": "baseline.ts",
      "hidden": "hidden.ts",
      "candidate": "solution.ts",
      "grade_mode": "separate",
      "commands": [
        [
          "npx",
          "tsc",
          "--strict",
          "--noImplicitReturns",
          "--target",
          "ES2022",
          "--module",
          "NodeNext",
          "--moduleResolution",
          "NodeNext",
          "solution.ts",
          "hidden.ts",
          "--outDir",
          "out"
        ],
        [
          "node",
          "out/hidden.js"
        ]
      ],
      "forbidden_patterns": [
        {
          "pattern": "\\bany\\b|@ts-(?:ignore|nocheck)|\\bas\\s+(?:const|[A-Za-z_$][A-Za-z0-9_$]*)\\b",
          "message": "TypeScript type bypasses such as any, suppressed diagnostics, and unchecked assertions are forbidden"
        },
        {
          "pattern": "\\bthrow\\b",
          "message": "throwing exceptions is forbidden"
        }
      ]
    },
    "go": {
      "signature": "package benchmark\n\nfunc KnapsackValue(weights []int64, values []int64, capacity int64) int64",
      "baseline": "baseline.go",
      "hidden": "hidden_test.go",
      "candidate": "solution.go",
      "grade_mode": "separate",
      "commands": [
        [
          "go",
          "test",
          "-run",
          "^$",
          "solution.go",
          "hidden_test.go"
        ],
        [
          "go",
          "test",
          "solution.go",
          "hidden_test.go"
        ]
      ],
      "forbidden_patterns": [
        {
          "pattern": "\\bany\\b|interface\\s*\\{\\s*\\}",
          "message": "Go type erasure through any or interface{} is forbidden"
        },
        {
          "pattern": "\\bpanic\\s*\\(",
          "message": "panic is forbidden"
        }
      ]
    },
    "rust": {
      "signature": "pub fn knapsack_value(weights: &[i64], values: &[i64], capacity: i64) -> i64",
      "baseline": "baseline.rs",
      "hidden": "hidden.rs",
      "candidate": "solution.rs",
      "grade_mode": "separate",
      "commands": [
        [
          "rustc",
          "--edition=2024",
          "--test",
          "hidden.rs",
          "-o",
          "{executable}"
        ],
        [
          "{executable}"
        ]
      ],
      "forbidden_patterns": [
        {
          "pattern": "\\bunsafe\\b|\\b(?:transmute|unreachable_unchecked)\\b",
          "message": "unsafe Rust and unchecked type escapes are forbidden"
        },
        {
          "pattern": "\\bpanic\\s*!",
          "message": "panic is forbidden"
        }
      ]
    }
  }
}
