{
  "id": "data_invoice_reconciliation",
  "version": "1.0.0",
  "title": "Reconcile invoice balances from signed entries",
  "category": "records",
  "difficulty": "medium",
  "statement": "Group all rows by invoice ID and sum amount, where positive amounts are charges and negative amounts are payments. Report number of distinct invoices whose final sum is zero, total positive final balances, and absolute total of negative final balances.",
  "constraints": [
    "invoice is nonnegative; amount is signed; duplicates are separate transactions, not deduplicated.",
    "Use the exact declared Entry and Report record fields and solve signature. Return all three Report fields; do not mutate the caller's records.",
    "All arithmetic fits signed int64; there are at most 30 records. Return fresh results; no I/O, tests, exceptions, panic, or static-check bypasses."
  ],
  "adapters": {
    "jett": {
      "signature": "namespace benchmark\n\nstruct Entry:\n    invoice: int64\n    amount: int64\n\nstruct Report:\n    settled: int64\n    outstanding: int64\n    credit: int64\n\nfunction solve(view rows: list[Entry]) returns Report",
      "baseline": "baseline.jett",
      "hidden": "hidden.jett",
      "candidate": "solution.jett",
      "grade_mode": "append",
      "commands": [
        [
          "{jett}",
          "build",
          "--check",
          "{candidate}"
        ],
        [
          "{jett}",
          "test",
          "{candidate}"
        ]
      ],
      "forbidden_patterns": []
    },
    "python": {
      "signature": "from dataclasses import dataclass\n\n@dataclass(frozen=True)\nclass Entry:\n    invoice: int\n    amount: int\n\n@dataclass(frozen=True)\nclass Report:\n    settled: int\n    outstanding: int\n    credit: int\n\ndef solve(rows: list[Entry]) -> Report",
      "baseline": "baseline.py",
      "hidden": "hidden.py",
      "support_files": [
        "pyrightconfig.json"
      ],
      "candidate": "solution.py",
      "grade_mode": "separate",
      "commands": [
        [
          "{pyright}",
          "--project",
          "pyrightconfig.json"
        ],
        [
          "python",
          "hidden.py"
        ]
      ],
      "forbidden_patterns": [
        {
          "pattern": "\\bAny\\b|#\\s*(?:type:\\s*ignore|pyright:\\s*ignore)|\\bcast\\s*\\(",
          "message": "Python type bypasses such as Any, casts, and ignored diagnostics are forbidden"
        },
        {
          "pattern": "\\braise\\b",
          "message": "raising exceptions is forbidden; return the documented report"
        }
      ]
    },
    "typescript": {
      "signature": "\nexport interface Entry {\n    readonly invoice: bigint;\n    readonly amount: bigint;\n}\n\nexport interface Report {\n    readonly settled: bigint;\n    readonly outstanding: bigint;\n    readonly credit: bigint;\n}\n\nexport function solve(rows: readonly Entry[]): Report",
      "baseline": "baseline.ts",
      "hidden": "hidden.ts",
      "candidate": "solution.ts",
      "grade_mode": "separate",
      "commands": [
        [
          "npx",
          "tsc",
          "--strict",
          "--noImplicitReturns",
          "--noFallthroughCasesInSwitch",
          "--target",
          "ES2022",
          "--module",
          "NodeNext",
          "--moduleResolution",
          "NodeNext",
          "solution.ts",
          "hidden.ts",
          "--outDir",
          "out"
        ],
        [
          "node",
          "out/hidden.js"
        ]
      ],
      "forbidden_patterns": [
        {
          "pattern": "\\bany\\b|@ts-(?:ignore|nocheck)|\\bas\\s+(?:const|[A-Za-z_$][A-Za-z0-9_$]*)\\b",
          "message": "TypeScript type bypasses such as any, suppressed diagnostics, and unchecked assertions are forbidden"
        },
        {
          "pattern": "\\bthrow\\b",
          "message": "throwing exceptions is forbidden; return the documented report"
        }
      ]
    },
    "go": {
      "signature": "package benchmark\n\ntype Entry struct {\n    Invoice int64\n    Amount int64\n}\n\ntype Report struct {\n    Settled int64\n    Outstanding int64\n    Credit int64\n}\n\nfunc solve(rows []Entry) Report",
      "baseline": "baseline.go",
      "hidden": "hidden_test.go",
      "candidate": "solution.go",
      "grade_mode": "separate",
      "commands": [
        [
          "go",
          "test",
          "-run",
          "^$",
          "solution.go",
          "hidden_test.go"
        ],
        [
          "go",
          "test",
          "solution.go",
          "hidden_test.go"
        ]
      ],
      "forbidden_patterns": [
        {
          "pattern": "\\bany\\b|interface\\s*\\{\\s*\\}",
          "message": "Go type erasure through any or interface{} is forbidden"
        },
        {
          "pattern": "\\bpanic\\s*\\(",
          "message": "panic is forbidden; return the documented report"
        }
      ]
    },
    "rust": {
      "signature": "\n#[derive(Debug, PartialEq, Eq)]\npub struct Entry {\n    pub invoice: i64,\n    pub amount: i64,\n}\n\n#[derive(Debug, PartialEq, Eq)]\npub struct Report {\n    pub settled: i64,\n    pub outstanding: i64,\n    pub credit: i64,\n}\n\npub fn solve(rows: &[Entry]) -> Report",
      "baseline": "baseline.rs",
      "hidden": "hidden.rs",
      "candidate": "solution.rs",
      "grade_mode": "separate",
      "commands": [
        [
          "rustc",
          "--edition=2024",
          "--test",
          "hidden.rs",
          "-o",
          "{executable}"
        ],
        [
          "{executable}"
        ]
      ],
      "forbidden_patterns": [
        {
          "pattern": "\\bunsafe\\b|\\b(?:transmute|unreachable_unchecked)\\b",
          "message": "unsafe Rust and unchecked type escapes are forbidden"
        },
        {
          "pattern": "\\bpanic\\s*!",
          "message": "panic is forbidden; return the documented report"
        }
      ]
    }
  }
}
