{
  "id": "data_reservation_gate",
  "version": "1.0.0",
  "title": "Accept bounded reservations independently",
  "category": "maintenance",
  "difficulty": "medium",
  "statement": "Repair the supplied implementation to satisfy this contract, preserving the public types and signature. The venue has limit seats. Consider requests in order. Reject a request if seats <= 0 or its party already has an accepted request or it would exceed capacity. Otherwise accept it and permanently reserve its seats. A rejected request does not reserve its party ID, so a later request by that party may succeed. Return counts accepted/rejected and occupied seats.",
  "constraints": [
    "party is nonnegative; seats may be negative;",
    "Use the exact declared Entry and Report record fields and solve signature. Return all three Report fields; do not mutate the caller's records.",
    "All arithmetic fits signed int64; there are at most 30 records. limit is in [0, 30]. Return fresh results; no I/O, tests, exceptions, panic, or static-check bypasses."
  ],
  "adapters": {
    "jett": {
      "signature": "namespace benchmark\n\nstruct Entry:\n    party: int64\n    seats: int64\n\nstruct Report:\n    accepted: int64\n    rejected: int64\n    occupied: int64\n\nfunction solve(view rows: list[Entry], limit: int64) returns Report",
      "baseline": "baseline.jett",
      "hidden": "hidden.jett",
      "candidate": "solution.jett",
      "grade_mode": "append",
      "commands": [
        [
          "{jett}",
          "build",
          "--check",
          "{candidate}"
        ],
        [
          "{jett}",
          "test",
          "{candidate}"
        ]
      ],
      "forbidden_patterns": [],
      "starter": "starter.jett"
    },
    "python": {
      "signature": "from dataclasses import dataclass\n\n@dataclass(frozen=True)\nclass Entry:\n    party: int\n    seats: int\n\n@dataclass(frozen=True)\nclass Report:\n    accepted: int\n    rejected: int\n    occupied: int\n\ndef solve(rows: list[Entry], limit: int) -> Report",
      "baseline": "baseline.py",
      "hidden": "hidden.py",
      "support_files": [
        "pyrightconfig.json"
      ],
      "candidate": "solution.py",
      "grade_mode": "separate",
      "commands": [
        [
          "{pyright}",
          "--project",
          "pyrightconfig.json"
        ],
        [
          "python",
          "hidden.py"
        ]
      ],
      "forbidden_patterns": [
        {
          "pattern": "\\bAny\\b|#\\s*(?:type:\\s*ignore|pyright:\\s*ignore)|\\bcast\\s*\\(",
          "message": "Python type bypasses such as Any, casts, and ignored diagnostics are forbidden"
        },
        {
          "pattern": "\\braise\\b",
          "message": "raising exceptions is forbidden; return the documented report"
        }
      ],
      "starter": "starter.py"
    },
    "typescript": {
      "signature": "\nexport interface Entry {\n    readonly party: bigint;\n    readonly seats: bigint;\n}\n\nexport interface Report {\n    readonly accepted: bigint;\n    readonly rejected: bigint;\n    readonly occupied: bigint;\n}\n\nexport function solve(rows: readonly Entry[], limit: bigint): Report",
      "baseline": "baseline.ts",
      "hidden": "hidden.ts",
      "candidate": "solution.ts",
      "grade_mode": "separate",
      "commands": [
        [
          "npx",
          "tsc",
          "--strict",
          "--noImplicitReturns",
          "--noFallthroughCasesInSwitch",
          "--target",
          "ES2022",
          "--module",
          "NodeNext",
          "--moduleResolution",
          "NodeNext",
          "solution.ts",
          "hidden.ts",
          "--outDir",
          "out"
        ],
        [
          "node",
          "out/hidden.js"
        ]
      ],
      "forbidden_patterns": [
        {
          "pattern": "\\bany\\b|@ts-(?:ignore|nocheck)|\\bas\\s+(?:const|[A-Za-z_$][A-Za-z0-9_$]*)\\b",
          "message": "TypeScript type bypasses such as any, suppressed diagnostics, and unchecked assertions are forbidden"
        },
        {
          "pattern": "\\bthrow\\b",
          "message": "throwing exceptions is forbidden; return the documented report"
        }
      ],
      "starter": "starter.ts"
    },
    "go": {
      "signature": "package benchmark\n\ntype Entry struct {\n    Party int64\n    Seats int64\n}\n\ntype Report struct {\n    Accepted int64\n    Rejected int64\n    Occupied int64\n}\n\nfunc solve(rows []Entry, limit int64) Report",
      "baseline": "baseline.go",
      "hidden": "hidden_test.go",
      "candidate": "solution.go",
      "grade_mode": "separate",
      "commands": [
        [
          "go",
          "test",
          "-run",
          "^$",
          "solution.go",
          "hidden_test.go"
        ],
        [
          "go",
          "test",
          "solution.go",
          "hidden_test.go"
        ]
      ],
      "forbidden_patterns": [
        {
          "pattern": "\\bany\\b|interface\\s*\\{\\s*\\}",
          "message": "Go type erasure through any or interface{} is forbidden"
        },
        {
          "pattern": "\\bpanic\\s*\\(",
          "message": "panic is forbidden; return the documented report"
        }
      ],
      "starter": "starter.go"
    },
    "rust": {
      "signature": "\n#[derive(Debug, PartialEq, Eq)]\npub struct Entry {\n    pub party: i64,\n    pub seats: i64,\n}\n\n#[derive(Debug, PartialEq, Eq)]\npub struct Report {\n    pub accepted: i64,\n    pub rejected: i64,\n    pub occupied: i64,\n}\n\npub fn solve(rows: &[Entry], limit: i64) -> Report",
      "baseline": "baseline.rs",
      "hidden": "hidden.rs",
      "candidate": "solution.rs",
      "grade_mode": "separate",
      "commands": [
        [
          "rustc",
          "--edition=2024",
          "--test",
          "hidden.rs",
          "-o",
          "{executable}"
        ],
        [
          "{executable}"
        ]
      ],
      "forbidden_patterns": [
        {
          "pattern": "\\bunsafe\\b|\\b(?:transmute|unreachable_unchecked)\\b",
          "message": "unsafe Rust and unchecked type escapes are forbidden"
        },
        {
          "pattern": "\\bpanic\\s*!",
          "message": "panic is forbidden; return the documented report"
        }
      ],
      "starter": "starter.rs"
    }
  }
}
