{
  "id": "data_union_coverage",
  "version": "1.0.0",
  "title": "Measure integer timeline coverage inside a window",
  "category": "schedule",
  "difficulty": "medium",
  "statement": "Clip all half-open intervals to [0,limit). All endpoints are integers, so measure each unit slot [t,t+1). Return the number of slots covered by at least one interval, number of maximal uncovered runs, and longest uncovered run length. Empty window has zero outputs.",
  "constraints": [
    "0 <= start < end; arbitrary input order and overlaps allowed.",
    "Use the exact declared Entry and Report record fields and solve signature. Return all three Report fields; do not mutate the caller's records.",
    "All arithmetic fits signed int64; there are at most 30 records. limit is in [0, 30]. Return fresh results; no I/O, tests, exceptions, panic, or static-check bypasses."
  ],
  "adapters": {
    "jett": {
      "signature": "namespace benchmark\n\nstruct Entry:\n    start: int64\n    end: int64\n\nstruct Report:\n    covered: int64\n    gaps: int64\n    longest_gap: int64\n\nfunction solve(view rows: list[Entry], limit: int64) returns Report",
      "baseline": "baseline.jett",
      "hidden": "hidden.jett",
      "candidate": "solution.jett",
      "grade_mode": "append",
      "commands": [
        [
          "{jett}",
          "build",
          "--check",
          "{candidate}"
        ],
        [
          "{jett}",
          "test",
          "{candidate}"
        ]
      ],
      "forbidden_patterns": []
    },
    "python": {
      "signature": "from dataclasses import dataclass\n\n@dataclass(frozen=True)\nclass Entry:\n    start: int\n    end: int\n\n@dataclass(frozen=True)\nclass Report:\n    covered: int\n    gaps: int\n    longest_gap: int\n\ndef solve(rows: list[Entry], limit: int) -> Report",
      "baseline": "baseline.py",
      "hidden": "hidden.py",
      "support_files": [
        "pyrightconfig.json"
      ],
      "candidate": "solution.py",
      "grade_mode": "separate",
      "commands": [
        [
          "{pyright}",
          "--project",
          "pyrightconfig.json"
        ],
        [
          "python",
          "hidden.py"
        ]
      ],
      "forbidden_patterns": [
        {
          "pattern": "\\bAny\\b|#\\s*(?:type:\\s*ignore|pyright:\\s*ignore)|\\bcast\\s*\\(",
          "message": "Python type bypasses such as Any, casts, and ignored diagnostics are forbidden"
        },
        {
          "pattern": "\\braise\\b",
          "message": "raising exceptions is forbidden; return the documented report"
        }
      ]
    },
    "typescript": {
      "signature": "\nexport interface Entry {\n    readonly start: bigint;\n    readonly end: bigint;\n}\n\nexport interface Report {\n    readonly covered: bigint;\n    readonly gaps: bigint;\n    readonly longest_gap: bigint;\n}\n\nexport function solve(rows: readonly Entry[], limit: bigint): Report",
      "baseline": "baseline.ts",
      "hidden": "hidden.ts",
      "candidate": "solution.ts",
      "grade_mode": "separate",
      "commands": [
        [
          "npx",
          "tsc",
          "--strict",
          "--noImplicitReturns",
          "--noFallthroughCasesInSwitch",
          "--target",
          "ES2022",
          "--module",
          "NodeNext",
          "--moduleResolution",
          "NodeNext",
          "solution.ts",
          "hidden.ts",
          "--outDir",
          "out"
        ],
        [
          "node",
          "out/hidden.js"
        ]
      ],
      "forbidden_patterns": [
        {
          "pattern": "\\bany\\b|@ts-(?:ignore|nocheck)|\\bas\\s+(?:const|[A-Za-z_$][A-Za-z0-9_$]*)\\b",
          "message": "TypeScript type bypasses such as any, suppressed diagnostics, and unchecked assertions are forbidden"
        },
        {
          "pattern": "\\bthrow\\b",
          "message": "throwing exceptions is forbidden; return the documented report"
        }
      ]
    },
    "go": {
      "signature": "package benchmark\n\ntype Entry struct {\n    Start int64\n    End int64\n}\n\ntype Report struct {\n    Covered int64\n    Gaps int64\n    LongestGap int64\n}\n\nfunc solve(rows []Entry, limit int64) Report",
      "baseline": "baseline.go",
      "hidden": "hidden_test.go",
      "candidate": "solution.go",
      "grade_mode": "separate",
      "commands": [
        [
          "go",
          "test",
          "-run",
          "^$",
          "solution.go",
          "hidden_test.go"
        ],
        [
          "go",
          "test",
          "solution.go",
          "hidden_test.go"
        ]
      ],
      "forbidden_patterns": [
        {
          "pattern": "\\bany\\b|interface\\s*\\{\\s*\\}",
          "message": "Go type erasure through any or interface{} is forbidden"
        },
        {
          "pattern": "\\bpanic\\s*\\(",
          "message": "panic is forbidden; return the documented report"
        }
      ]
    },
    "rust": {
      "signature": "\n#[derive(Debug, PartialEq, Eq)]\npub struct Entry {\n    pub start: i64,\n    pub end: i64,\n}\n\n#[derive(Debug, PartialEq, Eq)]\npub struct Report {\n    pub covered: i64,\n    pub gaps: i64,\n    pub longest_gap: i64,\n}\n\npub fn solve(rows: &[Entry], limit: i64) -> Report",
      "baseline": "baseline.rs",
      "hidden": "hidden.rs",
      "candidate": "solution.rs",
      "grade_mode": "separate",
      "commands": [
        [
          "rustc",
          "--edition=2024",
          "--test",
          "hidden.rs",
          "-o",
          "{executable}"
        ],
        [
          "{executable}"
        ]
      ],
      "forbidden_patterns": [
        {
          "pattern": "\\bunsafe\\b|\\b(?:transmute|unreachable_unchecked)\\b",
          "message": "unsafe Rust and unchecked type escapes are forbidden"
        },
        {
          "pattern": "\\bpanic\\s*!",
          "message": "panic is forbidden; return the documented report"
        }
      ]
    }
  }
}
