{
  "id": "data_ranking_ties",
  "version": "1.0.0",
  "title": "Assign competition ranks to scored submissions",
  "category": "records",
  "difficulty": "medium",
  "statement": "A submission ranks ahead of another if its score is higher, or its score is equal and its penalty is lower. Competition rank is 1 plus the number of records strictly ahead; identical score/penalty records share rank. Return number of records with rank <= limit, sum of those ranks, and number of distinct score/penalty groups containing at least two records across the whole input.",
  "constraints": [
    "score may be negative; penalty is nonnegative; duplicate records are separate submissions.",
    "Use the exact declared Entry and Report record fields and solve signature. Return all three Report fields; do not mutate the caller's records.",
    "All arithmetic fits signed int64; there are at most 30 records. limit is in [0, 30]. Return fresh results; no I/O, tests, exceptions, panic, or static-check bypasses."
  ],
  "adapters": {
    "jett": {
      "signature": "namespace benchmark\n\nstruct Entry:\n    score: int64\n    penalty: int64\n\nstruct Report:\n    selected: int64\n    rank_sum: int64\n    tie_groups: int64\n\nfunction solve(view rows: list[Entry], limit: int64) returns Report",
      "baseline": "baseline.jett",
      "hidden": "hidden.jett",
      "candidate": "solution.jett",
      "grade_mode": "append",
      "commands": [
        [
          "{jett}",
          "build",
          "--check",
          "{candidate}"
        ],
        [
          "{jett}",
          "test",
          "{candidate}"
        ]
      ],
      "forbidden_patterns": []
    },
    "python": {
      "signature": "from dataclasses import dataclass\n\n@dataclass(frozen=True)\nclass Entry:\n    score: int\n    penalty: int\n\n@dataclass(frozen=True)\nclass Report:\n    selected: int\n    rank_sum: int\n    tie_groups: int\n\ndef solve(rows: list[Entry], limit: int) -> Report",
      "baseline": "baseline.py",
      "hidden": "hidden.py",
      "support_files": [
        "pyrightconfig.json"
      ],
      "candidate": "solution.py",
      "grade_mode": "separate",
      "commands": [
        [
          "{pyright}",
          "--project",
          "pyrightconfig.json"
        ],
        [
          "python",
          "hidden.py"
        ]
      ],
      "forbidden_patterns": [
        {
          "pattern": "\\bAny\\b|#\\s*(?:type:\\s*ignore|pyright:\\s*ignore)|\\bcast\\s*\\(",
          "message": "Python type bypasses such as Any, casts, and ignored diagnostics are forbidden"
        },
        {
          "pattern": "\\braise\\b",
          "message": "raising exceptions is forbidden; return the documented report"
        }
      ]
    },
    "typescript": {
      "signature": "\nexport interface Entry {\n    readonly score: bigint;\n    readonly penalty: bigint;\n}\n\nexport interface Report {\n    readonly selected: bigint;\n    readonly rank_sum: bigint;\n    readonly tie_groups: bigint;\n}\n\nexport function solve(rows: readonly Entry[], limit: bigint): Report",
      "baseline": "baseline.ts",
      "hidden": "hidden.ts",
      "candidate": "solution.ts",
      "grade_mode": "separate",
      "commands": [
        [
          "npx",
          "tsc",
          "--strict",
          "--noImplicitReturns",
          "--noFallthroughCasesInSwitch",
          "--target",
          "ES2022",
          "--module",
          "NodeNext",
          "--moduleResolution",
          "NodeNext",
          "solution.ts",
          "hidden.ts",
          "--outDir",
          "out"
        ],
        [
          "node",
          "out/hidden.js"
        ]
      ],
      "forbidden_patterns": [
        {
          "pattern": "\\bany\\b|@ts-(?:ignore|nocheck)|\\bas\\s+(?:const|[A-Za-z_$][A-Za-z0-9_$]*)\\b",
          "message": "TypeScript type bypasses such as any, suppressed diagnostics, and unchecked assertions are forbidden"
        },
        {
          "pattern": "\\bthrow\\b",
          "message": "throwing exceptions is forbidden; return the documented report"
        }
      ]
    },
    "go": {
      "signature": "package benchmark\n\ntype Entry struct {\n    Score int64\n    Penalty int64\n}\n\ntype Report struct {\n    Selected int64\n    RankSum int64\n    TieGroups int64\n}\n\nfunc solve(rows []Entry, limit int64) Report",
      "baseline": "baseline.go",
      "hidden": "hidden_test.go",
      "candidate": "solution.go",
      "grade_mode": "separate",
      "commands": [
        [
          "go",
          "test",
          "-run",
          "^$",
          "solution.go",
          "hidden_test.go"
        ],
        [
          "go",
          "test",
          "solution.go",
          "hidden_test.go"
        ]
      ],
      "forbidden_patterns": [
        {
          "pattern": "\\bany\\b|interface\\s*\\{\\s*\\}",
          "message": "Go type erasure through any or interface{} is forbidden"
        },
        {
          "pattern": "\\bpanic\\s*\\(",
          "message": "panic is forbidden; return the documented report"
        }
      ]
    },
    "rust": {
      "signature": "\n#[derive(Debug, PartialEq, Eq)]\npub struct Entry {\n    pub score: i64,\n    pub penalty: i64,\n}\n\n#[derive(Debug, PartialEq, Eq)]\npub struct Report {\n    pub selected: i64,\n    pub rank_sum: i64,\n    pub tie_groups: i64,\n}\n\npub fn solve(rows: &[Entry], limit: i64) -> Report",
      "baseline": "baseline.rs",
      "hidden": "hidden.rs",
      "candidate": "solution.rs",
      "grade_mode": "separate",
      "commands": [
        [
          "rustc",
          "--edition=2024",
          "--test",
          "hidden.rs",
          "-o",
          "{executable}"
        ],
        [
          "{executable}"
        ]
      ],
      "forbidden_patterns": [
        {
          "pattern": "\\bunsafe\\b|\\b(?:transmute|unreachable_unchecked)\\b",
          "message": "unsafe Rust and unchecked type escapes are forbidden"
        },
        {
          "pattern": "\\bpanic\\s*!",
          "message": "panic is forbidden; return the documented report"
        }
      ]
    }
  }
}
